{"bindings":[{"allowed_lawful_moves":["probe_trace","deny_trace_closure","request_witness","defer_with_cost"],"assistant_contestant_allowed":false,"assistant_support":["coder.assistant:notary","evaluator.assistant:steward"],"binding_id":"agon.playbook_kernel_binding.broken_trace.v0","dry_run_allowed":true,"gate_trigger":"broken_trace_or_trace_gap","kernel_model_id":"agon.duel_kernel.mechanical_duel.v0","live_protocol":false,"owner_handoffs":["Agents-of-Abyss","abyss-stack","aoa-evals","aoa-memo","aoa-stats","aoa-sdk"],"playbook_id":"AOA-P-0033","playbook_slug":"agon-broken-trace-trial","required_packets":["agon.sealed_commit","agon.commit_receipt","agon.reveal_view","agon.move_declaration","agon.adjudication_request","agon.inscription_candidate"],"runtime_effect":"none","runtime_kernel_id":"abyss.runtime.agon.mechanical_duel_kernel.v0","trial_id":"agon.trial.mechanical.broken_trace.v0"},{"allowed_lawful_moves":["request_evidence","offer_evidence_reference","defer_with_cost","flag_scope_breach"],"assistant_contestant_allowed":false,"assistant_support":["coder.assistant:notary","reviewer.assistant:monitor"],"binding_id":"agon.playbook_kernel_binding.fallback_honor.v0","dry_run_allowed":true,"gate_trigger":"evidence_floor_collapse","kernel_model_id":"agon.duel_kernel.mechanical_duel.v0","live_protocol":false,"owner_handoffs":["Agents-of-Abyss","abyss-stack","aoa-evals","aoa-memo","aoa-stats","aoa-sdk"],"playbook_id":"AOA-P-0034","playbook_slug":"agon-fallback-honor-trial","required_packets":["agon.sealed_commit","agon.commit_receipt","agon.reveal_view","agon.evidence_reference","agon.revision_statement","agon.closeout_candidate"],"runtime_effect":"none","runtime_kernel_id":"abyss.runtime.agon.mechanical_duel_kernel.v0","trial_id":"agon.trial.mechanical.fallback_honor.v0"},{"allowed_lawful_moves":["mark_contradiction","localize_contradiction","deny_closure","defer_with_cost"],"assistant_contestant_allowed":false,"assistant_support":["evaluator.assistant:steward","memory-keeper.assistant:librarian"],"binding_id":"agon.playbook_kernel_binding.contradiction_endurance.v0","dry_run_allowed":true,"gate_trigger":"open_material_contradiction","kernel_model_id":"agon.duel_kernel.mechanical_duel.v0","live_protocol":false,"owner_handoffs":["Agents-of-Abyss","abyss-stack","aoa-evals","aoa-memo","aoa-stats","aoa-sdk"],"playbook_id":"AOA-P-0035","playbook_slug":"agon-contradiction-endurance-trial","required_packets":["agon.sealed_commit","agon.commit_receipt","agon.reveal_view","agon.contradiction_notice","agon.revision_statement","agon.adjudication_request"],"runtime_effect":"none","runtime_kernel_id":"abyss.runtime.agon.mechanical_duel_kernel.v0","trial_id":"agon.trial.mechanical.contradiction_endurance.v0"},{"allowed_lawful_moves":["deny_closure","request_closure_review","probe_trace","stand_fast"],"assistant_contestant_allowed":false,"assistant_support":["evaluator.assistant:steward","coder.assistant:notary"],"binding_id":"agon.playbook_kernel_binding.costly_closure.v0","dry_run_allowed":true,"gate_trigger":"contested_closure","kernel_model_id":"agon.duel_kernel.mechanical_duel.v0","live_protocol":false,"owner_handoffs":["Agents-of-Abyss","abyss-stack","aoa-evals","aoa-memo","aoa-stats","aoa-sdk"],"playbook_id":"AOA-P-0036","playbook_slug":"agon-costly-closure-trial","required_packets":["agon.sealed_commit","agon.commit_receipt","agon.reveal_view","agon.move_declaration","agon.adjudication_request","agon.closeout_candidate"],"runtime_effect":"none","runtime_kernel_id":"abyss.runtime.agon.mechanical_duel_kernel.v0","trial_id":"agon.trial.mechanical.costly_closure.v0"},{"allowed_lawful_moves":["flag_scope_breach","escalate_to_agon_gate","request_witness","defer_with_cost"],"assistant_contestant_allowed":false,"assistant_support":["architect.assistant:concierge","coder.assistant:notary","evaluator.assistant:steward"],"binding_id":"agon.playbook_kernel_binding.assistant_escalation.v0","dry_run_allowed":true,"gate_trigger":"assistant_scope_breach","kernel_model_id":"agon.duel_kernel.mechanical_duel.v0","live_protocol":false,"owner_handoffs":["Agents-of-Abyss","abyss-stack","aoa-evals","aoa-memo","aoa-stats","aoa-sdk"],"playbook_id":"AOA-P-0037","playbook_slug":"agon-assistant-escalation-trial","required_packets":["agon.open_draft","agon.charter_acceptance","agon.move_declaration","agon.witness_request","agon.inscription_candidate"],"runtime_effect":"none","runtime_kernel_id":"abyss.runtime.agon.mechanical_duel_kernel.v0","trial_id":"agon.trial.mechanical.assistant_escalation.v0"},{"allowed_lawful_moves":["assert_position","challenge_claim","revise_position","stand_fast"],"assistant_contestant_allowed":false,"assistant_support":["memory-keeper.assistant:librarian","reviewer.assistant:monitor"],"binding_id":"agon.playbook_kernel_binding.prediction.v0","dry_run_allowed":true,"gate_trigger":"model_divergence_above_threshold","kernel_model_id":"agon.duel_kernel.mechanical_duel.v0","live_protocol":false,"owner_handoffs":["Agents-of-Abyss","abyss-stack","aoa-evals","aoa-memo","aoa-stats","aoa-sdk"],"playbook_id":"AOA-P-0038","playbook_slug":"agon-prediction-trial","required_packets":["agon.sealed_commit","agon.commit_receipt","agon.reveal_view","agon.move_declaration","agon.revision_statement","agon.inscription_candidate"],"runtime_effect":"none","runtime_kernel_id":"abyss.runtime.agon.mechanical_duel_kernel.v0","trial_id":"agon.trial.mechanical.prediction.v0"},{"allowed_lawful_moves":["request_summon_intent","request_witness","challenge_claim","defer_with_cost"],"assistant_contestant_allowed":false,"assistant_support":["evaluator.assistant:steward","coder.assistant:notary"],"binding_id":"agon.playbook_kernel_binding.expensive_summon_intent.v0","dry_run_allowed":true,"gate_trigger":"summon_intent_requires_review","kernel_model_id":"agon.duel_kernel.mechanical_duel.v0","live_protocol":false,"owner_handoffs":["Agents-of-Abyss","abyss-stack","aoa-evals","aoa-memo","aoa-stats","aoa-sdk"],"playbook_id":"AOA-P-0039","playbook_slug":"agon-expensive-summon-intent-trial","required_packets":["agon.sealed_commit","agon.commit_receipt","agon.reveal_view","agon.summon_intent","agon.witness_request","agon.adjudication_request"],"runtime_effect":"none","runtime_kernel_id":"abyss.runtime.agon.mechanical_duel_kernel.v0","trial_id":"agon.trial.mechanical.expensive_summon_intent.v0"}],"count":7,"digest":"81940bf4dce17820b76b49ef642c0370f8fb94ebacb196dfe9cbb64c419b9e2a","registry_id":"agon.trial_kernel_binding.registry.v0","runtime_posture":"pre_protocol_candidate_only","wave":"XIII"}
